<?xml version="1.0" encoding="utf-8"?>

<Hypermedia xmlns="http://schema.bluehands.de/2022/Hypermedia.xsd"
            xmlns:xsi="http://www.w3.org/2001/XMLSchema-instance"
            xsi:schemaLocation="http://schema.bluehands.de/2022/Hypermedia.xsd ../../RESTyard.ContractFirst/RESTyard.Generator/Hypermedia.xsd">
  <TransferParameters>
    <Parameters typeName="CreateCustomerParameters" usedForQueries="false" usedForActions="true">
      <Property name="Name" type="string" mandatory="true" />
    </Parameters>
    <Parameters typeName="BuyCarParameters" usedForQueries="false" usedForActions="true">
      <Property name="Brand" type="string" mandatory="true" />
      <Property name="CarId" type="int" mandatory="true" />
      <Property name="Price" type="double" />
      <Property name="HiddenProperty" type="double" mandatory="false" hidden="true" />
    </Parameters>
    <Parameters typeName="BuyLamborghiniParameters" parentType="BuyCarParameters" usedForActions="true"
                usedForQueries="true">
      <Property name="Color" type="string" mandatory="true" />
      <Property name="OptionalProperty" type="int" />
    </Parameters>
    <Parameters typeName="BuyLamborghinettaParameters" parentType="BuyLamborghiniParameters" usedForActions="true"
                usedForQueries="true">
      <Property name="HorsePower" type="int" mandatory="true" />
    </Parameters>
    <Parameters typeName="NewAddress" usedForQueries="false" usedForActions="true">
      <Property name="Address" type="AddressTo" mandatory="true" />
    </Parameters>
    <Parameters typeName="AddressTo" usedForActions="false" usedForQueries="false">
      <Property name="Street" type="string" mandatory="true" />
      <Property name="Number" type="string" mandatory="true" />
      <Property name="City" type="string" mandatory="true" />
      <Property name="ZipCode" type="string" mandatory="true" />
    </Parameters>
    <Parameters typeName="UploadCarImageParameters" usedForActions="true" usedForQueries="false">
      <Property name="Text" type="string" mandatory="true" />
      <Property name="Flag" type="bool" mandatory="true" />
    </Parameters>
    <Parameters typeName="MarkAsFavoriteParameters" usedForActions="true" usedForQueries="false">
      <Property name="Customer" type="Uri" mandatory="true" />
    </Parameters>
    <Parameters typeName="CustomerPurchaseHistoryQuery" usedForQueries="true" usedForActions="false">
      <Property name="CardType" type="string" mandatory="false"/>
    </Parameters>
    <Parameters typeName="UpdateCarInspection" usedForActions="true" usedForQueries="false">
      <Property name="NewInspection" type="DateOnly" mandatory="true"/>
    </Parameters>
    <ExternalParameters typeName="CustomerQuery" />
  </TransferParameters>
  <Documents>
    <Document name="HypermediaEntrypoint" title="Entry to the Rest API">
      <Classifications>
        <Classification class="Entrypoint" />
      </Classifications>
      <Links>
        <Link rel="CustomersRoot" mandatory="true" document="HypermediaCustomersRoot" />
        <Link rel="CarsRoot" mandatory="true" document="HypermediaCarsRoot" />
      </Links>
    </Document>
    <Document name="HypermediaCarsRoot" title="The Cars API">
      <Classifications>
        <Classification class="CarsRoot" />
      </Classifications>
      <Operations>
          <Operation name="UploadCarImage" method="Post" title="Upload image for car" parameterTypeName="UploadCarImageParameters" isUploadAction="true" resultDocument="CarImage" />
          <Operation name="UploadInsuranceScan" method="Post" title="Upload scan of insurance for the car" isUploadAction="true" resultDocument="CarInsurance"/>
      </Operations>
      <Links>
        <Link rel="NiceCar" document="DerivedCar" mandatory="true" />
        <Link rel="SuperCar" document="HypermediaCar" mandatory="true" />
      </Links>
    </Document>
    <Document name="HypermediaCar" title="A Car">
      <Classifications>
        <Classification class="Car" />
      </Classifications>
      <Properties>
        <Property name="Id" type="int" isKey="true" />
        <Property name="Brand" type="string" isKey="true" />
        <Property name="PriceDevelopment" type="IEnumerable&lt;float&gt;" />
        <Property name="PopularCountries" type="List&lt;Country&gt;" />
        <Property name="MostPopularIn" type="Country" />
        <Property name="LastInspection" type="DateOnly" mandatory="false" />
      </Properties>
      <Operations>
        <Operation name="UpdateInspection" method="Patch" parameterTypeName="UpdateCarInspection" resultDocument="HypermediaCar" />
      </Operations>
    </Document>
    <Document name="CarImage" title="Image for a car">
      <Classifications>
        <Classification class="CarImage"/>
      </Classifications>
      <Properties>
        <Property name="Filename" type="string" isKey="true" hidden="true" />
      </Properties>
    </Document>
    <Document name="CarInsurance" title="Insurance scan for a car">
      <Classifications>
        <Classification class="CarInsurance"/>
      </Classifications>
      <Properties>
        <Property name="Filename" type="string" isKey="true" hidden="true" />
      </Properties>
    </Document>
    <Document name="DerivedCar" title="Derived Car" parentDocument="HypermediaCar">
      <Classifications>
        <Classification class="DerivedCar" />
      </Classifications>
      <Properties>
        <Property name="DerivedProperty" type="string" />
      </Properties>
      <Entities>
        <Entity collectionName="item" document="HypermediaCustomer" />
      </Entities>
      <Operations>
        <Operation name="DerivedOperation" method="Post" title="Derived Operation" />
      </Operations>
      <Links>
        <Link rel="DerivedLink" mandatory="false" document="HypermediaCustomer" />
      </Links>
    </Document>
    <Document name="NextLevelDerivedCar" title="Derives from Derived Car" parentDocument="DerivedCar">
      <Classifications>
        <Classification class="NextLevelDerivedCar" />
      </Classifications>
      <Properties>
        <Property name="NextLevelDerivedProperty" type="string" />
      </Properties>
    </Document>
    <Document name="HypermediaCustomersRoot" title="The Customers API">
      <Classifications>
        <Classification class="CustomersRoot" />
      </Classifications>
      <Operations>
        <Operation name="CreateCustomer" method="Post" title="Request creation of a new Customer."
                   parameterTypeName="CreateCustomerParameters" resultDocument="HypermediaCustomer" />
        <Operation name="CreateQuery" method="Query" title="Query the Customers collection."
                   parameterTypeName="CustomerQuery" resultDocument="HypermediaCustomerQueryResult" />
      </Operations>
      <Links>
        <Link rel="all" document="HypermediaCustomerQueryResult" query="CustomerQuery" mandatory="true" />
        <Link rel="BestCustomer" document="HypermediaCustomer" mandatory="true" />
        <Link rel="GreatSite" mandatory="true" />
        <Link rel="OkaySite" mandatory="false" />
      </Links>
    </Document>
    <Document name="CustomerPurchase" hasSelfLink="false">
      <Classifications>
        <Classification class="CustomerPurchase"/>
      </Classifications>
      <Properties>
        <Property name="Amount" type="int"/>
        <Property name="CardNumber" type="string" mandatory="true"/>
        <Property name="CardType" type="string" mandatory="true"/>
      </Properties>
    </Document>
    <Document name="CustomerPurchaseHistory" isQueryResult="true">
      <Classifications>
        <Classification class="CustomerPurchaseHistory"/>
      </Classifications>
      <Properties>
        <Property name="CustomerId" type="int" hidden="true" isKey="true"/>
      </Properties>
      <Entities>
        <Entity collectionName="Purchases" document="CustomerPurchase"/>
      </Entities>
    </Document>
    <Document name="HypermediaCustomer" title="Customer: {FullName} (Age {Age})">
      <Classifications>
        <Classification class="Customer" />
      </Classifications>
      <Properties>
        <Property name="Id" type="int" hidden="true" mandatory="true" isKey="true" />
        <Property name="Age" type="int" />
        <Property name="FullName" type="string" />
        <Property name="Address" type="AddressTo" />
        <Property name="IsFavorite" type="bool" mandatory="true" />
      </Properties>
      <Operations>
        <Operation name="CustomerMove" method="Put" title="A Customer moved to a new location."
                   parameterTypeName="NewAddress" />
        <Operation name="CustomerRemove" method="Delete" title="Remove a Customer." />
        <Operation name="MarkAsFavorite" method="Post" title="Marks a Customer as a favorite buyer."
                   parameterTypeName="MarkAsFavoriteParameters" />
        <Operation name="BuyCar" method="Post" title="Buy a car." parameterTypeName="BuyCarParameters" resultDocument="HypermediaCar" />
      </Operations>
      <Links>
        <Link rel="PurchaseHistory" mandatory="true" query="CustomerPurchaseHistoryQuery" document="CustomerPurchaseHistory"/>
      </Links>
    </Document>
    <Document name="HypermediaCustomerQueryResult" title="Query result on Customer" isQueryResult="true">
      <Classifications>
        <Classification class="CustomersQueryResult" />
      </Classifications>
      <Properties>
        <Property name="TotalEntities" type="int" />
        <Property name="CurrentEntitiesCount" type="int" />
      </Properties>
      <Entities>
        <Entity collectionName="Customers" document="HypermediaCustomer" />
      </Entities>
      <Links>
        <Link rel="Next" document="HypermediaCustomerQueryResult" query="IHypermediaQuery" mandatory="false" />
        <Link rel="Previous" document="HypermediaCustomerQueryResult" query="IHypermediaQuery" mandatory="false" />